{
  "schema_version": "hsie-world-reference/0.1",
  "place_id": "place:brevard-demo-street",
  "place_type": "PUBLIC_STREET",
  "status": "ACTIVE",
  "display_name": "SCENE-001 — Street",
  "parent_place_ref": null,
  "district_ref": null,
  "public_visibility": "PUBLIC",
  "steward_ref": null,
  "spaces": [],
  "representation_refs": [
    "representation:street-001-360-v1"
  ],
  "created_event_ref": null,
  "version": 1,
  "legacy_refs": [
    "street-001"
  ]
}
