{
  "schema_version": "hsie-world-reference/0.1",
  "place_id": "place:post-apocalyptic-crossroads",
  "place_type": "NARRATIVE_EXPERIENCE",
  "status": "ACTIVE",
  "display_name": "Post-Apocalyptic Brevard — The Crossroads",
  "parent_place_ref": null,
  "district_ref": null,
  "public_visibility": "PUBLIC",
  "steward_ref": null,
  "spaces": [
    {
      "space_id": "space:arrival",
      "space_type": "ARRIVAL",
      "display_name": "The Crossroads — Alternate Brevard",
      "status": "ACTIVE",
      "representation_refs": [
        "representation:post-apocalyptic-crossroads-360-v1"
      ],
      "legacy_refs": [
        "phase15:post-apocalyptic-arrival"
      ]
    }
  ],
  "representation_refs": [
    "representation:post-apocalyptic-crossroads-360-v1"
  ],
  "created_event_ref": null,
  "version": 1,
  "legacy_refs": [
    "TB-PA:public-spatial-entry",
    "WRB-001-PHASE-15-POST-APOCALYPTIC-CROSSROADS"
  ]
}
